{
  "$schema": "https://json-schema.org/draft/2020-12/schema",
  "$id": "https://wts.is/schemas/experiences/v1/bootstrap-request.json",
  "type": "object",
  "additionalProperties": false,
  "required": [
    "schemaVersion",
    "consent",
    "profileConsentGranted",
    "actorId",
    "sessionId",
    "metadata",
    "settings"
  ],
  "properties": {
    "schemaVersion": { "const": 1 },
    "consent": { "enum": ["contextual", "personalized"] },
    "profileConsentGranted": { "type": "boolean" },
    "actorId": { "type": "string", "minLength": 8, "maxLength": 128 },
    "sessionId": { "type": "string", "minLength": 8, "maxLength": 128 },
    "testDeviceToken": {
      "type": "string",
      "format": "uuid"
    },
    "metadata": { "$ref": "common.schema.json#/$defs/metadata" },
    "settings": { "$ref": "common.schema.json#/$defs/settings" }
  },
  "allOf": [
    {
      "if": { "properties": { "consent": { "const": "personalized" } } },
      "then": { "properties": { "profileConsentGranted": { "const": true } } }
    }
  ]
}
